post_id,local_filename,entity_keywords_od,entity_keywords_full,scene_keywords,style_keywords,entity_count_od,entity_count_full,scene_count,style_count,caption,detailed_caption,post_title,post_score,bot_ai_percent
1nsqio7,1nsqio7_b428b47928be0fbe.jpg,person,background; beard; blue; cartoon; collage; color; expression; eye; feel; finger; hand; he; illustration; image; letter; light; mouth; mustache; person; raid; scheme; shirt; sign; style; that,,cartoon; illustration,1,25,0,2,"The image shows a man with a beard and a black shirt holding a sign that reads ""Raid"" in the background of a vibrant red and blue color scheme. The man is animated, giving the image a lively and energetic feel.","The image is a collage of six illustrations of a man with different facial expressions. The background is a dark blue with red and pink lights scattered throughout. The man is wearing a black t-shirt and has a beard and mustache. He is holding up a sign that reads ""RAID"" in white letters. 

In the first illustration, the man is covering his eyes with his hands and has his mouth open, as if he is surprised or shocked. The second illustration shows him with his eyes closed and his hands covering his face. The third illustration shows the man with a surprised expression, and the fourth illustration shows a man holding up his hand with his fingers. The fifth illustration shows another man with his hand on his face, and he is smiling.

The overall style of the illustration is cartoon-like and playful.",,0,
1ntrtgq,1ntrtgq_a7c6894ce1827d32.jpg,poster,border; city; color; conflict; control; country; description; detail; each; east; eastern; egypt; end; gaza; government; image; intensity; israel; legend; line; location; map; mediterranean; middle; poster; process; progress; section; situation; stage; states; strip; symbol; text; that; this; trump; united; war; water; which,city,,1,41,1,0,"The image shows a poster with a map of the end of the Gaza War, with text detailing the war's progress. The map is divided into sections, with each section representing a different stage of the war, such as the Israeli-Gaza border, the Gaza Strip, and the Gaza City border. The text on the poster provides further details about the war and its progress.","The image is a map of the end of Gaza War, which is a conflict between the United States and Israel. The map is divided into different sections, each representing a different country.

The map shows the location of the conflict, with the countries such as Egypt, Israel, and the Middle East visible. The countries are marked with red and blue lines, indicating the intensity of the war. The red lines represent the conflict between Israel and the Israel, while the blue lines represent Israel. 

There is also a legend on the map that explains the different colors and symbols used to represent the different countries. The text on the image reads ""TRUMP: END OF Gaza WAR"" and ""IDF current line of control"". This indicates that the conflict is in the process of being controlled by the Israeli government and that the government is responsible for controlling the conflict. The image also includes a brief description of the situation, which states that the war will continue to continue in the Middle Eastern and Mediterranean Sea.",,0,
1nphnfl,1nphnfl_b532fcf70da036ad.jpg,washing machine,all; background; bottom; brick; cheap; floor; gold; graffiti; image; left; machine; middle; one; painting; room; row; side; style; text; that; trick; wall; washing; washing machine; window,indoor; room,black_and_white; painting,1,25,2,2,"The image shows a laundry room with a wall in the background featuring a painting and text that reads ""Cheap Trick, Cheap Trick, All Washed Up"". The floor is visible at the bottom of the image.","The image shows a laundry room with a brick floor and a wall covered in graffiti that reads ""Cheap Trick, Cheap Trick, All Washed Up"". There are three washing machines in the image - one is white, one is red, and one is gold. The washing machines are arranged in a row, with the white washing machine on the left, the red washing machine in the middle, and the gold washing machine at the bottom. The graffiti is in black and white and appears to be in a graffiti-like style. The walls are painted white and there is a window on the right side of the image.",,0,
1nm5qhx,1nm5qhx_323a79ead4a28d54.jpg,dinosaur; poster,background; city; claw; color; creature; dinosaur; distance; expression; godzilla; image; king; letter; lettering; mix; monsters; mouth; movie; orange; outcropping; poster; scheme; sky; skyline; sun; surface; text; title; tone; tooth; top,city,,2,30,1,0,"The image shows a poster of Godzilla, the King of the Monsters, on a wooden surface. The poster features a large, menacing creature with a menacing expression, surrounded by a fiery orange and yellow background. The text on the poster reads ""Godzilla"" in bold, black lettering.","The image is a poster for the movie ""Godzilla"". It features a large, menacing creature with sharp teeth and sharp claws. The creature appears to be Godzilla, the King of the Monsters, with its mouth open wide and its teeth bared. It is standing on a rocky outcropping with a city skyline in the background. The sky is orange and yellow, and the sun is setting in the distance. The title of the movie is written in bold, yellow letters at the top of the poster. The overall color scheme is dark and ominous, with a mix of orange, yellow, red, and black tones.",,0,
1nvewwu,1nvewwu_caad09467697a455.jpg,person; poster,america; background; center; close; event; expression; fest; film; flags; fright; good; great; hair; horror; image; mouth; neck; orange; person; poster; sale; scary; sense; she; snickers; strip; suspense; text; tickets; up; which,,macro,2,31,0,1,"The image shows a poster for the Six Flags Great America Fright Fest, featuring a woman with a menacing expression on her face, surrounded by a dark background. The text on the poster reads ""Scary Good Sale Tickets as Low as $39"".","The image is a promotional poster for the Six Flags Great America Fright Fest Snickers event. The background is dark blue and the text is in orange and white. In the center of the poster, there is a close-up of a woman's face with long dark hair and a menacing expression. She is holding a large film strip in her mouth, which is wrapped around her neck. The film strip appears to be made up of multiple film strips, creating a sense of horror and suspense. The text on the poster reads ""Scary Good Sale Tickets as low as $39"".",,0,
1nvwmhy,1nvwmhy_db8d49ce2ad05980.jpg,footwear; person,area; audience; back; background; baseball; brick; building; cap; child; clothing; company; cookies; cooky; electronics; footwear; front; girl; image; information; jacket; khaki; pant; partner; partners; person; product; railing; range; reminder; samsung; screen; screenshot; service; shirt; sidewalk; stair; target; technology; text; that; they; use; user,shop,,2,43,1,0,"The image shows a man carrying a child on his back in front of a building, with a screenshot of a mobile screen displaying the text ""Samsung Electronics and its Partners, Use Cookies"". The man is wearing a blue shirt and green pants, while the child is wearing pink and white clothing. The background of the image is a grassy area with a few stairs and a railing.","The image shows a man carrying a young girl on his back. The man is wearing a blue jacket, khaki pants, and a white baseball cap. He is standing on a sidewalk with a brick building in the background. The girl is wearing pink pants and a blue shirt. They are both smiling and appear to be enjoying each other's company.

The image is accompanied by a text that reads ""Samsung Electronics and its partners, use cookies and similar technologies. It's a secure, reliable, and reliable technology that allows users to access and store their products. It also provides information on the best-selling, non-essential technology, and how to use cookies. It is a reminder that the company offers a wide range of products and services to help users reach their target audience.",,0,
1nvn63j,1nvn63j_68589118ae737838.jpg,broccoli,app; bottom; broccoli; brown; button; calorie; carrot; cheese; cooking; cube; easy; food; icon; image; item; join; kraft; link; low; macandcheese; macaroni; noodle; perfection; phone; photo; picture; plate; profile; rice; screen; screenshot; text; that; tofu; top; variety; vegetable; veggie,,photograph,1,38,0,1,"The image shows a screenshot of a mobile screen with a picture of a plate of food on it. The plate is filled with a variety of food items, including rice, vegetables, and tofu. The text on the screen reads ""Easy Low-Calorie Cooking"" and there are several icons at the top of the screen.","The image is a screenshot of a mobile phone screen with a photo of a plate of food. The plate is filled with a variety of food items, including rice, tofu, broccoli, carrots, and noodles. The tofu is golden brown and appears to be cooked to perfection. The broccoli is bright green and looks fresh and healthy. The carrots are orange and are cut into small cubes. The noodles are white and fluffy. The text on the screen reads ""Easy low-calorie plate: baked tofu, rice, and veggies."" Below the text, there is a button that says ""Join"" and a link to join the app. At the bottom of the screen, there are two profile pictures - one of Kraft MacandCheese and the other of Kraft macaroni and cheese.",,0,
1np4bm7,1np4bm7_e068801557ec2038.jpg,bracelet; earrings; heart; person; swimwear,backdrop; background; bikini; black; bottom; bracelet; camera; center; chest; damn; earring; earrings; front; garden; gold; hair; heart; hoop; illustration; image; jon; lil; miami; palm; person; pitbull; setting; she; shirt; sky; swimwear; text; tree; word,garden,digital_art; illustration,5,34,1,2,"The image shows a woman wearing a white t-shirt with the words ""Damn Miami"" printed on it, standing in front of a backdrop of trees.","The image is a digital illustration of a young woman posing in a tropical setting. She is wearing a white t-shirt with the words ""Damn Miami"" written in black across the chest and a red heart in the center. The woman is also wearing black bikini bottoms and gold hoop earrings. She has long dark hair and is smiling at the camera. The background is blurred, but it appears to be a tropical garden with palm trees and a blue sky. The text ""Pitbull"" and ""Lil Jon"" are written in smaller text below the image.",,0,
1nvxw42,1nvxw42_ee64d34165e9686b.jpg,bookcase; house; studio couch; table,book; bookcase; bookshelf; carpet; ceiling; coffee; color; cushion; floor; frame; frank; future; house; image; lamp; living; lloyd; object; panel; part; photo; room; set; side; sofa; speaker; staircase; studio couch; style; table; that; view; wall; water; window; wood; wright,indoor; room,minimalist; modern; painting,4,37,2,3,"The image shows a living room with a sofa set with cushions, a table with books and other objects, a bookshelf with books, a lamp, speakers, a photo frame on the wall, and a large window. The room is designed by Frank Lloyd Wright and is part of the House of the Future.","The image shows a modern living room with a high ceiling and a large window that offers a beautiful view of the ocean. The room is furnished with a white sofa set, a wooden coffee table, and a bookshelf on the right side. The floor is covered with a blue carpet, and there is a wooden staircase leading up to the second floor. The walls are painted in a light color, and the ceiling is made of wood panels. The overall style of the room is minimalistic and contemporary.",,0,
1nx9jjm,1nx9jjm_154680e2abd8d5a7.jpg,person; picture frame,art; background; border; center; color; effect; expression; eye; frame; image; mix; pattern; person; picture; picture frame; piece; portrait; print; purple; rectangle; shape; square; style; wall; wire,indoor,portrait,2,25,1,1,"The image shows a framed picture of a woman's face on a wall, with a mosaic of a person's face in the center. The mosaic is composed of various colors and shapes, creating a unique and eye-catching piece of art.","The image is a framed art print hanging on a black wire wall. The frame is black and has a white border. Inside the frame, there is a colorful portrait of a woman's face made up of small squares and rectangles in various colors. The squares are arranged in a mosaic-like pattern, creating a mosaic effect. The woman's eyes are blue and her expression is peaceful and serene. The background of the portrait is a mix of red, orange, yellow, green, blue, and purple, with a geometric pattern in the center. The overall style of the image is reminiscent of a mosaic or mosaic art piece.",,0,
1nmwkbv,1nmwkbv_6c0146e4fb55e995.jpg,person,background; center; close; concert; effect; expression; front; guitar; hand; he; image; light; performance; person; pole; rainbow; setting; shade; shirt; sky; stage; up,rainy,macro,1,22,1,1,"The image shows a man standing in front of a stage, illuminated by a light pole and surrounded by a dark background. He is holding a guitar in his hands.","The image is a close-up of a man's face. He is wearing a black t-shirt and appears to be in a concert or performance setting. The background is dark and there are colorful lights shining down on him. In the center of the image, there is a tall pole with a colorful light shining on it. The light is in shades of green, blue, and yellow, creating a rainbow-like effect. The man is looking up towards the sky with a serious expression on his face.",,0,
1nyrqti,1nyrqti_11e2121a5afa5e38.jpg,footwear,advertisement; anniversary; apples; babie; babies; background; bottom; button; child; color; company; explorations; exploring; footwear; free; image; opportunity; pair; poster; row; sale; shipping; shoe; shoes; sock; sponsored; text; that; tiny; today; toddlers; top; variety,,,1,33,0,0,"The image shows a poster with a variety of baby shoes in different colors, with the text ""Tiny Explorings Free Sock-Shoes for Toddlers & Babies"" written across the top. The poster is advertising a free sock-shoe sale, offering a great opportunity to get it free today.","The image is an advertisement for Tiny Explorings, a company that offers free sock-shoes for toddlers and babies. The advertisement has a blue background with white text that reads ""Free sock-Shoes For Toddlers & Babies... See more! Only for our 2nd anniversary today!"" Below the text, there is an image of six pairs of toddler shoes in different colors - blue, pink, yellow, gray, and orange. The shoes are arranged in a row, with the first pair being blue, the second pair being pink, the third pair being yellow, the fourth pair being orange, and the fifth pair being white. The text on the advertisement reads ""Tiny Explorations Sponsored - Free Sock-Shoe For Toddler & Babie... See More!"" and ""Free Today! Only For our 2ND Anniversary today!"" There is also a button at the bottom of the advertisement that says ""Get It Free Today! Shipping Apples!""",,0,
1njgoxc,1njgoxc_1f2ce5c0d89c750b.jpg,computer monitor; table,article; background; ceiling; computer; computer monitor; crisis; device; dot; dr.; font; hand; image; light; map; monitor; news; object; orientation; pointing; rack; sapna; school; screen; screenshot; side; singh; skepticism; states; student; table; text; that; today; top; united; usa; website; wire,plain_background,,2,38,1,0,"The image shows a computer monitor sitting on top of a desk, with a map of the United States on the screen. On the desk there are wires, a device, and other objects. In the background, there are racks with various objects, and lights on the ceiling. This image is likely related to the news that Dr. Sapna Singh has been reported to have been reported on the USA Today website.","The image is a screenshot of a news article on the USA Today website. The article is titled ""Vaccine skepticism crisis spills over as students return to school with Dr. Sapna Singh"". The article has a white background with black text. On the right side of the screen, there is a map of the United States with red dots scattered across it. The map is in a horizontal orientation and appears to be a hand pointing to the map. The text on the screen is in black font and is centered on the desk.",,0,
1nqvxwn,1nqvxwn_d5ff5589211523dd.jpg,cake; cake stand; duck; flower,background; beak; birthday; bow; cake; cake stand; center; color; curtain; daisy; design; duck; ducky; field; flower; image; lover; neck; number; orange; pattern; side; stand; table; top; topper,field,,4,26,1,0,"The image shows a green cake with two ducks and daisies on top of it, sitting on a table with a curtain in the background. The cake is decorated with fondant duckies, making it a perfect birthday cake for a duck lover.","The image is of a three-tiered cake on a white cake stand. The cake is light green in color and has a fondant design on top. On top of the cake, there are three white daisies with yellow centers. The daisy flowers are arranged in a symmetrical pattern around the cake. On the left side, there is a blue number 4 cake topper with a white fondant duck on top, and on the right side, two white ducks with orange beaks and green bows on their necks. The ducks are standing on a grassy field with white daisy leaves. The background is blurred, but it appears to be a wooden table with a black curtain.",,0,
1nswqg8,1nswqg8_302d43b146c17ad8.jpg,person,background; cartoon; center; character; close; corner; design; disney; donald; duck; goofy; illustration; image; mickey; mouse; movie; pattern; person; pluto; shirt; style; torso; up; which,,black_and_white; cartoon; illustration; macro,1,24,0,4,"The image shows a person wearing a white t-shirt with a Mickey Mouse design on it, which is a popular Disney character.","The image is a close-up of a person's torso wearing a white t-shirt with a graphic design on it. The design features a black and white illustration of Mickey Mouse's face in the center, surrounded by various cartoon characters from the Disney movie ""Mickey Mouse."" The characters are arranged in a circular pattern around Mickey's head, with Mickey Mouse in the top left corner and Mickey in the bottom right corner. The background of the design is filled with colorful illustrations of other Disney characters such as Mickey Mouse, Donald Duck, Goofy, and Pluto. The overall style of the image is playful and whimsical.",,0,
1noqtj8,1noqtj8_34aaa182ea22286c.jpg,whale,background; cloud; color; energy; foreground; humpback; image; mood; movement; photograph; purple; sense; sky; sun; sunset; surface; water; whale,sunset,photograph,1,18,1,1,"The image shows two humpback whales breaching the surface of the water at sunset, with the sky in the background filled with clouds.","The image is a photograph of a beautiful sunset over the ocean. The sky is filled with vibrant colors of orange, pink, and purple, with the sun setting in the background. The water is calm and reflects the colors of the sky. In the foreground, there are three humpback whales breaching the surface of the water. The whales are silhouetted against the sky, creating a sense of movement and energy. The overall mood of the image is peaceful and serene.",,0,
1nrv6f9,1nrv6f9_b0ec03a02492d94e.jpg,marine invertebrates,air; appearance; area; attack; center; close; corner; creature; hole; image; left; marine invertebrates; material; object; pebble; rock; sand; shark; surface; that; up; water; worm,,macro,1,23,0,1,"The image shows a small hole in the sand with a worm crawling out of it, likely caused by a shark attack.","The image shows a close-up of a sandy surface with a small hole in the center. The surface appears to be made of a light-colored material, possibly sand or sand, and there are small rocks and pebbles scattered around the hole. On the top right corner of the image, there is a long, thin, curved object that looks like a starfish or a sea creature. The object is slightly tilted to the left, as if it is floating in the air. The overall appearance is that of a small, circular hole in a sandy area.",,0,
1nxt89g,1nxt89g_c23137fbbf04ab8a.jpg,mushroom; porcupine,account; area; background; bush; camera; expression; grass; hedgehog; image; january; left; link; logo; mushroom; orange; pages; patch; paw; plant; porcupine; sage; sagebetweenthepage; sagebetweenthepages; screenshot; text; they; top; tree; tweet; twitter,indoor; room,,2,30,2,0,"The image shows two hedgehogs sitting on top of a mushroom in the grass, surrounded by lush green plants. The text on the image reads ""Sage Between the Pages"" and there are several other mushrooms scattered around them.","The image is a screenshot of a tweet from Sagebetweenthepages on January 9, 2023. It shows two hedgehogs sitting on a patch of green grass with a few mushrooms scattered around them. The hedgehog on the left is holding an orange mushroom in its paws and is looking at the camera with a curious expression. The other hedgehog is sitting next to it and is holding a small orange mushroom. The background is blurred, but it appears to be a wooded area with trees and bushes. The tweet is accompanied by a logo for SagebetweenThepages and a link to the Twitter account.",,0,
1njl6n1,1njl6n1_1a97ba7bd88fb0c6.jpg,poster,ash; ashe; ashes; background; band; border; center; contrast; damned; danger; depth; design; dimension; eye; font; image; letter; logo; poster; rest; sense; size; text; word,plain_background,,1,24,1,0,"The image shows a black background with the text ""Ashes of the Damned"" written in white font. The text is bold and stands out against the dark background, creating a striking contrast. The font is modern and eye-catching, making it stand out against it. The words are surrounded by a thin white border, giving the image a sense of depth and dimension.","The image is a logo for a band called ""Ashes of the Damned"". The logo is written in a dark, ominous font with the word ""Ashe's"" in the center and ""of the damned"" written in smaller, bold letters below it. The word ""Damned"" is in a larger, bold font size than the rest of the text. The background of the logo is black, making the text stand out. The overall design is dark and ominous, conveying a sense of danger and danger.",,0,
1nsdtye,1nsdtye_b6bcafcce97c7c4d.jpg,footwear; person,background; cartoon; coat; design; footwear; front; george; hand; illustration; image; left; number; person; president; shirt; shoe; sin; states; trouser; united; washington,,cartoon; illustration,2,21,0,2,"The image shows a black t-shirt with a cartoon image of George Washington holding a number 7 in his hand, symbolizing the seven deadly sins of the United States.","The image is of a black t-shirt with a graphic design on the front. The design features a cartoon illustration of George Washington, the former President of the United States, holding a large number 7 in his right hand. He is wearing a blue coat, yellow trousers, and blue shoes. The number 7 is red and is slightly tilted to the left. The background of the design is white.",,0,
1nt6tzt,1nt6tzt_0f7004c39be8baeb.jpg,cake; muffin,background; brick; cake; center; color; cone; countertop; cream; cupcake; cursive; frosting; ice; icing; image; marble; muffin; one; popsicle; pyramid; scoop; shape; side; silver; sprinkle; stand; surface; tier; top; wall; word,,,2,30,0,0,"The image shows a pink and purple cake with ice cream cones on top of it, sitting on a white surface. The cake is decorated with pink frosting and sprinkles, and the ice cream is topped with a scoop of ice cream.","The image is of a three-tiered cake with pink and purple frosting. The cake is on a silver cake stand and is placed on a white marble countertop. On top of the cake, there are three ice cream cones with pink frosting and blue popsicles. The cones are arranged in a pyramid-like shape, with the largest cone in the center and the smaller ones on either side. The word ""One"" is written in cursive on the cake in a light pink color. There are also two small cupcakes on the bottom tier, one with pink icing and the other with purple icing. The background is a white brick wall.",,0,
1njexuf,1njexuf_83a4408fd1e3534c.jpg,boat; person,assassin; background; black; boat; bow; building; cloud; creed; culture; distance; flag; foreground; game; hand; history; horizon; image; mood; mountain; outfit; painting; person; representation; sailboat; scene; ship; side; sky; sword; tree; turban; water,beach; city; mountain,painting,2,32,3,1,"The image shows a man in a boat on the water, surrounded by ships, buildings, trees, hills and a sky with clouds. The painting is titled ""Assassin's Creed IV Black Flag"" and is a representation of the game's history and culture.","The image is a painting of a coastal scene with a man on a boat in the foreground. The man is wearing a traditional white outfit with a turban on his head and is holding a sword in his right hand. He is standing on the bow of the boat and appears to be looking out towards the horizon. In the background, there are several sailboats sailing on the ocean. The sea is a deep blue and there are mountains in the distance. On the right side of the image, there is a hill covered in white buildings and trees. The sky is blue with a few clouds. The overall mood of the painting is peaceful and serene.",,0,
