post_id,local_filename,entity_keywords_od,entity_keywords_full,scene_keywords,style_keywords,entity_count_od,entity_count_full,scene_count,style_count,caption,detailed_caption,post_title,post_score,bot_ai_percent
1no2hwx,1no2hwx_510cc926c2787999.jpg,cat; flowerpot; houseplant; poster,background; book; cat; design; flower; flowerpot; frame; houseplant; image; newspaper; paw; poster; pot; side; text; that; toilet; vase; wall; wood; word; you,,minimalist,4,22,0,1,"The image shows a black cat sitting on a pot, reading a book, surrounded by a frame with the words ""Are you pooping?"" printed on it. On the right side of the image, there is a flower vase and a few books, and on the left side, there are a few more books. The background is a white wall.","The image is a framed poster with a black cat sitting on a toilet. The cat is holding a newspaper in its paws and appears to be reading it intently. The background of the poster is green with white text that reads ""Are you pooping?"" The poster is displayed on a white wall with a vase of white flowers on the right side. The frame is made of wood and has a simple design.",,0,
1nmaxk0,1nmaxk0_31be92090468bde2.jpg,girl; person,background; bow; braid; detail; drawing; dress; expression; eye; girl; hair; heart; icon; illustration; image; mark; neck; person; plant; question; scarf; she; side; sketchbook; style; surface; tablet; timer,,anime; digital_art; illustration,2,27,0,3,"The image shows a tablet with a drawing of a girl with red hair and a red bow on it, sitting on a wooden surface with a plant in the background. The drawing is done in a sketchbook style, with the girl's face and hair drawn in detail.","The image is a digital illustration of a young girl with long black hair and red bows on her head. She has a serious expression on her face and her eyes are closed. Her hair is styled in two braids and she is wearing a black dress with a red scarf tied around her neck. The background is white and there are various icons on the right side of the image, including a heart, a question mark, and a timer. The overall style of the illustration is anime-inspired.",,0,
1nsxg3r,1nsxg3r_aeb888e9d3e1ab05.jpg,bread; common fig,appetizer; background; baked; board; bread; brie; cheese; common fig; cookbook; cutting; dish; fig; figs; herb; holiday; image; parsley; pecan; pecane; pecans; sauce; screenshot; side; slice; sprig; texture; top; tweet; warm,,,2,29,0,0,"The image shows a wooden cutting board topped with a delicious-looking brie cheese, figs, and pecans, making it the perfect holiday appetizer.","The image is a screenshot of a tweet from a cookbook. The tweet reads ""Warm Baked Brie with Figs and Pecans"". The tweet is accompanied by an image of a brie cheese dish with figs and pecans on top. The brie is white and has a creamy texture. It is drizzled with a light brown sauce and is garnished with chopped pecane and herbs. There are also slices of bread on the side of the brie. The background is a wooden cutting board with a sprig of parsley.",,0,
1nuphtz,1nuphtz_2e6ae3e4149f157a.jpg,cat; poster,atmosphere; background; banner; border; boumeau; camera; cat; cekpem; center; cerpem; day; design; english; expression; feel; fern; font; gold; image; kammep; komple; komti; language; leaf; left; middle; momblaunnyku; moon; mother; person; poster; reference; russian; side; spun; style; tabby; text; that; top; tree; which; wood; word,forest,vintage,2,44,1,1,"The image shows a poster with three cats in the woods, surrounded by trees, a moon, and a banner with the text ""Komti-Boumeau - Cekpem Momblaunnyku"" written on it. The cats are surrounded by lush green leaves, creating a peaceful and serene atmosphere.","The image is a poster or banner with a vintage style. It has a dark brown background with a gold border and a red banner at the top that reads ""Spun Kammep"" in Russian. Below the banner, there is a banner with the words ""Komple-Boumeau"" written in a cursive font. 

In the center of the poster, there are three cats - a white cat, a brown tabby cat, and a brown and white tabby. The cat on the left is looking directly at the camera with a curious expression, while the cat in the middle is looking away from the camera. The other two cats are standing behind the banner with their heads tilted slightly to the side.

The banner is decorated with green ferns and a banner that says ""Cerpem Momblaunnyku"" which translates to ""Mother's Day"" in English. The banner also has a banner at that says the text in Russian, which is a reference to the Russian language. The overall design is ornate and ornate, with a rustic feel.",,0,
1nihysw,1nihysw_c04a9db2ae48f13a.jpg,person,background; camera; expression; eye; focus; hair; image; person; portrait; she; side; text; video,plain_background,macro; portrait,1,13,1,2,"The image shows a woman with long blonde hair smiling at the camera against a white background. On the left side of the image, there is some text.","The image is a close-up portrait of a woman's face. She has blonde hair and blue eyes. She is smiling and looking directly at the camera. The background is blurred, so the focus is on the woman's head. The image appears to be a still from a video or a promotional video. The woman's expression is friendly and relaxed.",,0,
1nmrdm7,1nmrdm7_926d20a0170a78d7.jpg,skyscraper,background; balcony; barrier; board; bottom; building; car; city; cup; highway; image; lane; light; mood; perspective; pole; road; screenshot; section; side; signal; sky; skyscraper; street; traffic; tree; video; watermark; window,city; street,,1,29,2,0,"The image shows a city street with cars driving down it, surrounded by tall buildings, trees, poles, boards, and a traffic signal with a pole. The sky is visible in the background, and there is a watermark at the bottom of the image.","The image is a screenshot from a video taken from a car window. It shows a highway with multiple lanes of traffic. The highway is divided into two sections, with a concrete barrier on one side and a highway divider on the other. On both sides of the highway, there are tall buildings with glass windows and balconies. The sky is overcast and the overall mood of the image is gloomy. There are several cars driving on the highway and a traffic light on the right side. The image appears to be taken from the perspective of the car window, looking down on the road.",,0,
1nmvlob,1nmvlob_0ebcb0ef2ce47d31.jpg,curtain,artist; background; bun; center; circle; close; color; composition; curtain; design; dress; effect; energy; expression; fabric; hair; image; manner; movement; neck; painting; pattern; person; purple; rachael; ray; sense; shape; shawl; she; shoulder; shower; square; texture; triangle; up; variety,plain_background,abstract; macro,1,37,1,2,"The image shows a shower curtain with a painting of a woman's face on it, created by artist Rachael Ray. The curtain is made of a light-colored fabric and has a unique design with a variety of colors and shapes. The woman in the painting is wearing a white dress with a blue shawl draped over her shoulders. Her hair is pulled back in a bun and she has a gentle expression on her face.","The image is a close-up of a curtain with a colorful abstract design. The curtain is made of white fabric with a white background. The design is made up of various shapes and colors, including blue, pink, purple, orange, and yellow. The shapes are arranged in a chaotic and chaotic manner, creating a sense of movement and energy.

The center of the curtain is a large, abstract figure with a large head and a long neck. The figure is surrounded by a variety of shapes and patterns, including circles, squares, and triangles. The figures are also made of different colors and textures, including pink, blue, green, and purple. The overall effect is one of energy and movement, with the colors blending together to create a dynamic and dynamic composition.",,0,
1nkzjz9,1nkzjz9_9153bd99588ca929.jpg,cat,background; birthday; bouquet; bunch; card; cat; color; direction; flower; font; greeting; heart; illustration; image; pattern; ribbon; someone; star; text; that; variety,,digital_art; illustration,1,21,0,2,"The image shows a birthday card with a bunch of cats in a pink flower bouquet, surrounded by a variety of colorful flowers. The card is decorated with a festive pattern of stars and hearts, and the text reads ""Happy Birthday!"" in a cheerful font.","The image is a digital illustration of a bouquet of cats. The bouquet is made up of multiple cats of different colors - black, white, pink, and gray - arranged in a circular pattern. The cats are all facing the same direction and are tied together with a pink ribbon. The background is white and there are pink flowers scattered throughout the bouquet. Above the cats, there is text that reads ""Happy Birthday"" in a playful font. The image appears to be a birthday greeting card for someone special.",,0,
1ntpi4w,1ntpi4w_7a38b92dc70b29eb.jpg,skyscraper,atmosphere; background; building; car; city; concrete; design; facade; footpath; image; look; person; plant; road; side; sky; skyscraper; street; tree; wall,city; street,modern,1,20,2,1,"The image shows a city street with tall buildings on either side, and a green wall on the side of one of the buildings. There are vehicles on the road, people walking on the footpath, and trees lining the street. The sky is visible in the background.","The image shows a modern city street with tall buildings on both sides. The buildings are made of concrete and have a unique architectural design. On the right side of the image, there is a tall building with a green wall covering the entire facade. The wall is made up of vertical plants and trees, creating a natural and organic look. The street is lined with trees and there are cars driving on the road. The sky is blue and the overall atmosphere is bright and sunny.",,0,
1noqgj3,1noqgj3_c5a2ebf54a9aec57.jpg,mobile phone,1900; 1990; amount; bottom; button; case; chickenpox; country; covid-19; day; death; description; fact; icon; image; information; link; list; mobile phone; number; phone; savile; screen; screenshot; states; text; that; time; today; united; vaccination; vaccine; varicella; website; which,,,1,35,0,0,"The image shows a screenshot of a mobile screen with text and icons, depicting the Covid-19 vaccine in the United States. The text reads ""Chickenpox Vaccination"" and the icons indicate that the vaccine is being administered in the country.","The image is a screenshot of a mobile phone screen with a list of facts about Chickenpox (Varicella) in the early 1990s. The list is titled ""Before the vaccine"" and is accompanied by a brief description of the vaccine. 

The list includes information about the vaccine, including the number of cases of chickenpox, the total number of deaths, and the total amount of deaths. The first case is for the first time, the second is for a vaccine, and it shows that the vaccine was released in the United States. The third case is from the first day of the vaccination, which was released from the early 1900s to the early 2000s.

At the bottom of the screen, there is a button that says ""Today"" and a link to the website ""Chickenpox Savile Lives"".",,0,
1ny8n6l,1ny8n6l_f25ac0c081f11fbb.jpg,flag; person,anime; background; cartoon; character; circle; cloud; emblem; expression; flag; front; hair; hand; illustration; image; jumpsuit; logo; manner; naruto; orange; outfit; outline; person; protagonist; series; shippuden; signature; sky; smile; spiky; style; uzumaki,,anime; cartoon; digital_art; illustration,2,31,0,4,"The image shows a cartoon of Naruto, the protagonist of the popular anime series Naruto Shippuden, holding a flag with a logo on it. He is wearing his signature orange and black outfit and has a determined expression on his face. The flag he is holding is red, white, and blue, and the logo is a yellow circle with a black outline.",The image is a digital illustration of the character Naruto Uzumaki from the anime series Naruto Shippuden. He is standing in front of a large red and black flag with a yellow and red emblem on it. Naruto is wearing his signature orange jumpsuit and has a big smile on his face. His hair is styled in a spiky manner and he is saluting with his right hand. The background is a light blue sky with white clouds. The overall style of the illustration is cartoon-like and playful.,,0,
1nkmlbu,1nkmlbu_3770609a5eecdf95.jpg,car,awe; background; building; bush; car; center; cloud; desert; distance; formation; glow; ground; horizon; hue; image; landscape; line; middle; monument; mood; photograph; plant; road; rock; shrub; side; sky; sun; sunset; top; usa; utah; valley; wispy,street; sunset,landscape; photograph,1,34,2,2,"The image shows an empty road in Monument Valley, Utah, USA, with a beautiful sunset in the background. The sky is filled with clouds, and the ground is covered with plants.","The image is a landscape photograph of a long, straight road in the middle of a desert. The road is in the center of the image, with the horizon line visible in the distance. The sky is filled with vibrant orange and red hues, with a few wispy clouds scattered across the horizon. The sun is setting, casting a warm glow over the landscape. On either side of the road, there are barren shrubs and bushes, and in the background, there is a large rock formation with a castle-like structure on top. The overall mood of the photograph is dramatic and awe-inspiring.",,0,
1nme2wm,1nme2wm_29363687343e85b0.jpg,shirt,bed; bedsheet; cable; cartoon; character; cone; cup; custard; design; front; frozen; hand; image; letter; object; person; shirt; smile; spoon; sweatshirt; text; that; waffle; word,,cartoon,1,24,0,1,"The image shows a black sweatshirt with the words ""Frozen Custard"" printed on it, lying on a bed with a cable and an object beside it.","The image is of a black sweatshirt with an orange graphic design on the front. The design features a cartoon character of a cup of frozen custard with a spoon in its hand. The cup is wearing a waffle cone on its head and has a big smile on its face. Above the cup, there is text that reads ""Frozen Custard"" in orange letters. The sweatshirt is laid out on a white bedsheet.",,0,
1nvot9s,1nvot9s_d6c6c7528dac3cb6.jpg,person,all; app; background; bottom; button; center; download; games; hair; icon; image; list; lords; metal; music; name; note; outfit; person; platform; player; screen; screenshot; side; soaring; soarling; song; star; user; word,plain_background,black_and_white,1,30,1,1,"The image shows a screenshot of a music player with the words ""Soaring Metal Lords"" on it, along with a list of songs and icons. It is likely a music streaming app, as indicated by the ""Download Music Player"" button at the bottom of the screen.","The image is a screenshot of the music player app ""Soaring Metal Lords"". The app has a black background with a white image of a person's face in the center. The person has long black hair and is wearing a black outfit. Below the image, there is a list of popular songs from the app, including ""Popular"", ""Soarling Star"", ""All's Fair"", and ""Name of Games"". There are also three green icons on the right side of the screen - a green music note, a black and white image, and a white music note. The app appears to be a music streaming platform for users to listen to music.",,0,
1nwwci3,1nwwci3_97b4ba5b9dc9e6c2.jpg,person,arm; art; background; belt; chain; fight; fist; hair; hand; headband; image; impression; manner; middle; mood; neck; pant; person; portrait; shirt; side; sword; that; waist,,portrait,1,24,0,1,"The image shows a man in a red shirt and black pants, holding a sword in his hand and a chain around his neck. He is standing in a dark background, giving the impression of a powerful and determined figure.","The image is a portrait of a man dressed in a martial arts pose. He is wearing a red sleeveless shirt with a black belt around his waist and a red headband tied around his head. He has long dark hair that is styled in a messy yet fashionable manner. The man is holding a long, wooden sword with a chain wrapped around it. He appears to be in the middle of a fight, with his arms stretched out to the sides and his fists clenched. The background is dark, making the man and the sword stand out. The overall mood of the image is intense and powerful.",,0,
1np16k3,1np16k3_24638c959c6d8310.jpg,person; television,angle; background; belt; camera; center; color; computer; control; corridor; floor; image; impression; line; machine; middle; object; panel; person; picture; scheme; screen; screenshot; side; space; surveillance; television; wall,indoor,,2,27,1,0,"The image shows a computer screen with a video camera on it, displaying a person standing in the middle of the picture. The person is surrounded by various objects, giving the impression of a surveillance camera.","The image is a screenshot from a video camera. It shows a long, narrow corridor with a yellow line running along the center. On the right side of the corridor, there is a large machine with a blue and white color scheme. The machine appears to be a conveyor belt or a control panel. The background is blurred, but it seems to be an indoor space with a concrete floor and walls. The image is taken from a high angle, looking down on the corridor.",,0,
1nmrwsb,1nmrwsb_f6a17e786a4c0b21.jpg,boy; person; picture frame; poster,ball; basket; boy; bread; brick; cage; duintje; dutch; field; frame; grass; illustration; image; lamp; moon; nieuw; person; phrase; picture; picture frame; poster; probeer; shirt; short; side; t't; text; that; wall; which; wire; you,field,illustration,4,32,1,1,"The image shows a brick wall with a picture frame hanging on it. The frame contains a picture of a boy holding a ball, and there is a lamp on the left side of the frame.","The image is a framed poster hanging on a brick wall. The poster has an illustration of a young boy holding a basket of bread and smiling. The boy is wearing a blue and white striped shirt and shorts and is standing in a field of tall grass. The text on the poster reads ""Nieuw! T'T duintje"" which translates to ""I'm not a boy, I'm a boy"". Below the illustration, there is a text in Dutch that reads ""Probeer nu 2.95"" which is a Dutch phrase meaning ""I love you to the moon and back"". The poster is framed in a black wooden frame and is hanging on the wall next to a lamp with a wire cage.",,0,
1nuuuoa,1nuuuoa_cc45308f4d325847.jpg,earrings; necklace; person; sunglasses,arm; background; call; camera; car; chair; clip; earrings; gold; hair; image; interior; leather; love; middle; necklace; open; pair; person; selfie; she; smile; song; sunglass; sunglasses; sunroof; tank; that; top; updo; video; what; window,indoor,,4,33,1,0,"The image shows a woman in a white tank top and sunglasses sitting in the back seat of a car, with the sunroof open and the windows of the vehicle visible. She appears to be in the middle of a video call, likely from a video clip of her song ""I Don't Know What To Do With It"".","The image is a selfie of a young woman sitting in the back seat of a car. She is wearing a white tank top and has a pair of sunglasses on her head. Her hair is styled in a braided updo and she is looking directly at the camera with a slight smile on her face. She has a gold necklace with a pendant that reads ""Love"" and a tattoo on her left arm. The background shows the interior of the car with black leather seats and a window.",,0,
1no9755,1no9755_cd510301ed1a4b3b.jpg,book; poster,album; almanac; background; book; bottom; button; center; cover; creepy; faded; feel; font; footprints; gm; hour; image; landscape; minutes; mountain; option; photo; picture; play; poster; purchase; screen; screenshot; sep; songs; text; that; tree,mountain; plain_background,landscape; photograph,2,32,2,2,"The image shows a screenshot of a mobile screen with a picture of a book and text that reads ""The Almanac of Faded Footprints"". The book is open and the text is written in a bold font, giving the image a mysterious and captivating feel.","The image is a screenshot of an album titled ""The Almanac of Faded Footprints"" by Creepy GM. The album cover is displayed on a black background with a photo of an open book in the center. The book is titled ""15 Songs - 1 Hour and 13 Minutes - Sep 08 2025"" and is surrounded by a green landscape with trees and mountains in the background. At the bottom of the image, there is a play button and a purchase options button.",,0,
1nz0hz1,1nz0hz1_ad418a88ed4c667a.jpg,helmet; person,background; camouflage; concrete; expression; flashlight; hand; helmet; image; night; person; rifle; side; tunnel; uniform; water,night,,2,15,1,0,"The image shows a man in a military uniform, wearing a helmet and holding a flashlight, submerged in a dark tunnel.","The image shows a man wearing a helmet with a flashlight on his head, submerged in a dark tunnel. He is wearing a camouflage uniform and appears to be looking towards the right side of the image. The tunnel is made of concrete and is filled with water. The man is holding a rifle in his right hand and is submerged in the water. He has a determined expression on his face. The background is dark, suggesting that the tunnel is located at night.",,0,
1nz673x,1nz673x_e01ca0cd90fa8cca.jpg,house,atmosphere; border; bridge; bush; castle; center; color; dreamy; feel; forest; gothic; house; illustration; image; middle; mood; mystery; plant; roof; side; sky; style; tower; tree; window; wonder,forest,digital_art; illustration,1,26,1,2,"The image shows a large castle with a tower in the middle of a forest, surrounded by lush green plants and trees. The castle has windows and is framed by a black border, giving it a mysterious and magical feel.","The image is a digital illustration of a large, old, Gothic-style house with a pointed roof and a tower in the center. The house is surrounded by trees and bushes, and there is a bridge on the left side of the image. The sky is visible through the trees, and the overall atmosphere is peaceful and serene. The colors are muted, giving the image a dreamy and ethereal feel. The overall mood of the illustration is one of mystery and wonder.",,0,
1ns1ho9,1ns1ho9_d6ca233ffff63cb6.jpg,person; poster,action; air; all; america; arm; background; black; bottom; captain; center; character; color; comics; expression; group; hawkeye; helmet; illustration; image; iron; letter; line; marvel; mix; person; pose; poster; scene; series; size; some; spider; style; suit; superhero; text; thor; title; universe; variety; wall; weapon; whom; widow,,comic; illustration,2,44,0,2,"The image shows a poster of Spider-Man from the Marvel Comics universe on a wall. The poster features a variety of characters from the series, including Iron Man, Captain America, Thor, Black Widow, and Hawkeye, as well as text describing the series.","The image is a poster for the Marvel Comics series Spider-Man. It features a group of superheroes in a chaotic and action-packed scene. The background is a mix of orange, yellow, and blue colors, with the title of the series written in bold yellow letters at the bottom.

In the center of the poster, there is a large spider-man in the air, with his arms outstretched and a determined expression on his face. He is surrounded by six other superheroes, all of whom are in various poses and sizes. The superheroes are all wearing suits and helmets, and some are holding weapons. The overall style of the illustration is reminiscent of the Marvel universe, with bold lines and bright colors.",,0,
1nr4cil,1nr4cil_efc87cf77f95cb0e.jpg,drinking straw,ashley; background; crm; cube; cup; direct; drinking straw; ice; iced; image; ingredient; investing; label; link; liquid; list; matcha; med; milk; name; product; pump; scoop; screenshot; section; side; soy; straw; sugar; syrup; table; tea; text; that; website; which; www.td.com,plain_background,,1,37,1,0,"The image shows a cup of green tea with a straw in it, sitting on a table. The cup has a label on it that reads ""Ashley Med Iced Matcha"".","The image is a screenshot of a product list of Ashley Med. Iced Matcha. The list is written in black text on a white background and is in a plastic cup with a straw. The cup is filled with a light green liquid, which appears to be a matcha, and has a label on it that reads ""Ashley Med. iced matcha"". The label also mentions that the product is 2.5 scoops of soy milk, 2.25 oz of soy Milk, and 1.5 pump reg sugar syrup. The product is 1.1 pump reg syrup, 1.2% whole crm, 1% non-crm, and 3% ice cubes. The label is divided into two sections, with the left side showing the product name and the right side showing its ingredients. The bottom section of the image has a link to the TD Direct Investing website, www.td.com.",,0,
