post_id,local_filename,entity_keywords_od,entity_keywords_full,scene_keywords,style_keywords,entity_count_od,entity_count_full,scene_count,style_count,caption,detailed_caption,post_title,post_score,bot_ai_percent
1nkln59,1nkln59_6c87276b8f2c96ce.jpg,person,android; app; background; bottom; button; download; fall; glitch; gradient; house; image; iphone; letter; list; option; person; picture; playlist; pose; real; red; screen; screenshot; setting; side; sleep; sleepwise; subscribe; subscription; text; that; top; user; video; vides; which; you,plain_background,,1,37,1,0,"The image shows a screenshot of the Sleepwise app on an iPhone, with text and images of people. The text reads ""Sleepwise for Android"" and the images depict people in various poses, suggesting that the app is designed to help users manage their sleep.","The image is a screenshot of the SleepWise app on an iPhone. The app has a black background with a colorful gradient at the top. Below the gradient, there is a text that reads ""SleepWise"" in white letters. At the top of the screen, there are two buttons - ""Home"" and ""Videos"". Below the text, it says ""Subscribe"" in red letters. 

On the left side of the image, there has a profile picture of a person with their head tilted to the side, and on the right side, it reads ""For you"" in black letters. Below that, it states that the app is available for download, with a list of videos and playlists.

At the bottom of the screenshot, it shows the ""Every Real Glitch Explained to Fall"" button, which is highlighted in red. There are also several other options available, such as ""Vides"", ""Subscriptions"", and ""Settings"".",,0,
1nstc8y,1nstc8y_eeed4494c06e3860.jpg,car; flower; person; wheel,advice; background; bottom; building; car; chaos; cloud; collage; desert; destruction; dirt; distance; field; flag; flower; foreground; ground; health; image; landscape; level; mental; metal; mood; other; person; picture; plant; road; roading; shipwreck; sky; text; they; top; wheel,field; street,landscape,4,36,2,1,"The image shows a collage of two pictures. At the top of the image, there are two vehicles on the ground, with a person sitting in one of them. In the background, there is a sky with clouds, and at the bottom of the picture there are plants with flowers. The text on the image reads ""My Mental Health, My Advice to Others"".","The image is a collage of two pictures. The top picture shows a desert landscape with a large shipwreck in the background. The shipwreck appears to be made of metal and has multiple levels and structures. There are several flags flying from the shipwreck.

The bottom picture shows two vehicles on a dirt road, one in the foreground and the other in the distance. The vehicles are black and appear to be off-roading. The sky is blue and there are a few clouds in the sky. The ground is covered in a field of colorful flowers. The overall mood of the image is one of destruction and chaos.",,0,
1ny09d5,1ny09d5_fb631ed54b8741aa.jpg,person,background; bandage; bar; battle; button; cartoon; character; date; diaries; diy; download; dress; expression; front; game; hair; hand; heart; icon; image; interface; look; makeup; middle; name; person; picture; player; profile; reo; screen; screenshot; she; showcase; sponsored; suit; suitugame; sword; text; that; thumbnail; time; top; vampire; wrist,,,1,45,0,0,"The image shows a screenshot of a mobile screen with a cartoon image of a woman in a white dress and a man in a black suit. The text on the screen reads ""Download the Vampire Diaries - Screenshot Thumbnail"".","The image is a screenshot of a mobile game interface. It shows two characters, one with long dark hair and the other with short black hair, standing in front of a purple background. The character with the black hair is wearing a white bandage wrapped around her wrists and has a menacing expression on her face. She is holding a sword in her right hand and appears to be in the middle of a battle.

At the top of the screen, there is a date and time bar, indicating that the game is 14:16. Below the date bar, there are two buttons - ""Play game"" and ""DIY stunning makeup looks and showcase"". The player's name is ""Sponsored"" and the player's profile picture is ""Suitugame"".

There are also several icons on the screen that appear to be related to the game, such as a heart, a heart-shaped icon, and a button that says ""REO"".",,0,
1nkimwz,1nkimwz_84f49e1d9a77387b.jpg,pumpkin,cartoon; cheez; chez; chimney; citrouille; citrouilles; citrôles; cultivés; depuis; design; english; ferme; forest; french; front; hagrad; hagrid; house; image; magic; magie; par; picture; pumpkin; roof; shirt; text; that; tree; water; which,forest,cartoon; minimalist,1,31,1,2,"The image shows a grey t-shirt with a picture of a house and pumpkins, along with the text ""Chez Hagrid - Ferme de Citrouilles Cultivés Par Magic"" printed on it.","The image is a graphic design on a grey t-shirt. It features a small house with a thatched roof and a chimney, surrounded by pumpkins and trees. The house is located in a forest-like setting with a lake in front of it. Above the house, there is text that reads ""Chez Hagrid"" in French, which translates to ""Cheez Hagrad"" in English. Below the text, it reads ""Depuis 1981"" in smaller French. The text below the house reads ""Ferme de citrouilles cultivées par magic"" which is French for ""Citrôles culturees par magie"". The overall design is simple and cartoon-like.",,0,
1nm6tsd,1nm6tsd_63e0d7746fe81fb4.jpg,bird; helmet; motorcycle; person; wheel,air; back; background; basket; bike; bird; body; chair; crossbones; design; front; hand; handlebar; helmet; image; logo; mood; motorcycle; pant; person; railing; road; seagull; skull; sky; tank; top; tree; view; water; wheel,street,,5,31,1,0,"The image shows a man riding a motorcycle down a road next to the ocean, with a basket attached to the back of the bike. The road is lined with trees and a railing, and in the background there is a body of water and a sky with birds flying in the air.","The image shows a young man riding a yellow motorcycle on a road near the ocean. He is wearing a white helmet with a skull and crossbones design on it, a black tank top, and green pants. He has a basket on the back of the motorcycle and is holding onto the handlebars with both hands. The motorcycle has a red and white logo on the front and a black seat. The background shows a beautiful view of the ocean and a few seagulls flying in the sky. The overall mood of the image is playful and adventurous.",,0,
1no2v7o,1no2v7o_1714b973e9486078.jpg,animal,accident; amount; angle; animal; background; bunch; car; center; concrete; debris; ground; image; mumbai; night; object; person; piece; pile; pipe; seaweed; side; some; street; they; trash; video; wall; water; watermark; who,night; street,,1,30,2,0,"The image shows a flooded street with a bunch of trash in it, and in the center of the image there is a watermark. In the background there is an object, and the image is taken from a video of a man who was killed in a car accident in Mumbai.","The image shows a flooded street at night. The street is made of concrete and there is a large amount of water covering the ground. In the center of the image, there are several pieces of debris scattered across the street. The debris appears to be a pile of seaweed or seaweed, with some of them partially submerged in the water. There is a white pipe running along the side of the street and a white wall on the left side. The image is taken from a low angle, looking up at the debris.",,0,
1nl0c6x,1nl0c6x_9bdbf4ce7cee321f.jpg,cutting board; kitchen knife,background; board; center; collage; crust; cutting; cutting board; english; focus; hand; image; kitchen knife; knife; person; photo; piece; steak; text; which; 我们司,,photograph,2,20,0,1,"The image shows a person cutting up a piece of steak on a wooden cutting board with a knife. The person's hands are visible, holding the knife and cutting the steak, and there is text in the background.","The image is a collage of two photos. The first photo shows a person's hands holding a large knife and cutting a piece of cooked steak on a wooden cutting board. The steak appears to be a medium-rare, with a pinkish-brown crust and a juicy center. The person is using the knife to cut the steak into smaller pieces. The background is blurred, but it seems like the focus is on the person and the steak. The text on the image reads ""我们司"" which translates to ""How to cut a steak?"" in English.",,0,
1nmdjbp,1nmdjbp_bafac268a7113132.jpg,bicycle; bicycle wheel; person,back; background; backpack; basket; bicycle; bicycle wheel; cloud; coat; feather; front; grass; hat; illustration; image; impression; left; life; mood; mountain; movement; person; rock; side; sky; they,,illustration,3,25,0,1,"The image shows two people riding a bicycle through tall grass, with a sky in the background. The illustration is animated, giving the impression of movement and life.","The image shows two people riding bicycles on a grassy hill. The person on the left is wearing a hat and a long coat, and is riding a bicycle with a basket on the front. The other person is riding on the back of the bicycle, wearing a backpack and holding a white feather. They are both looking towards the right side of the image. The background is a light blue sky with a few clouds. The hill is covered in tall grasses, and there are a few rocks scattered around. The overall mood of the illustration is peaceful and serene.",,0,
1nunwbx,1nunwbx_77c52172296b66d6.jpg,bird; rabbit,background; bird; blue; body; border; branch; character; cloud; color; eevee; eeveevee; eeyore; feature; flower; illustration; image; island; leaf; look; middle; pikachu; plant; pokemon; pokémon; prey; rabbit; rock; scene; side; sky; squirtle; style; top; tree; variety; water,,digital_art; illustration,2,36,0,2,"The image shows a vibrant and colorful scene of a tree with a variety of Pokemon characters perched atop it, surrounded by lush green leaves and vibrant flowers. The sky is filled with fluffy white clouds and the water below is a deep blue. The image is framed with a black border, giving it a classic and timeless look.","The image is a digital illustration of a small island in the middle of a body of water. The island is covered in colorful flowers and plants, and there are several Pokémon characters scattered around it. The background is a deep blue sky with white clouds, and the water is a light blue-green color.

On top of the island, there is a large tree with green leaves and branches. The tree is surrounded by a variety of colorful flowers, including pink, purple, yellow, and orange. There are also several smaller Pokémon characters, including Pikachu, Eevee, Squirtle, and Eeveevee. On the right side of the image, there are two smaller Pokémon, Pikachu and Eeyore, sitting on a rock, and Pikachu is standing on the rock. On both sides of the tree, there appears to be a small bird, possibly a bird or a bird of prey. The overall style of the illustration is whimsical and playful, with bright colors and exaggerated features.",,0,
1nwq0l4,1nwq0l4_06ece32bb7774bc4.jpg,bench; footwear; person,arm; background; baseball; bench; both; boyfriend; building; cap; clothe; conversation; fence; footwear; front; hand; image; left; metal; middle; overlay; pant; person; phone; roof; screenshot; shirt; short; something; stadium; text; that; they; this; video; watermark,,,3,34,0,0,"The image shows two men sitting on a bench in front of a building, with a fence in the background. One of the men is wearing a cap and the other is holding something in his hand. There is a watermark on the image, suggesting that it is a screenshot from a video of a boyfriend mad and his happened.","The image shows two young men sitting on a bench in a stadium. They are both wearing casual clothes and appear to be engaged in a conversation. The man on the left is wearing a white t-shirt, black shorts, and a baseball cap, while the man in the middle is wearing an orange shirt and black pants. They both have their arms around each other and are looking at their phones. The background shows a metal fence and a building with a green roof. There is a text overlay on the image that reads ""Was trying to get a video of my boyfriend mad and this happened.""",,0,
1nsv2qa,1nsv2qa_1522cb9ae9f8efc7.jpg,cat; handbag; knife,background; bag; body; cat; closure; color; corner; countertop; fabric; handbag; illustration; image; kitchen; knife; leg; painting; pouch; side; spot; surface; table; wall; zipper,room,illustration,3,23,1,1,"The image shows a small zipper bag with a painting of a cat on it, sitting on a table with a knife beside it. In the background, there is a wall.","The image is of a small zipper pouch with a small illustration of a kitten on it. The kitten is orange and brown in color with white spots on its body and legs. It is sitting on a white surface with a black zipper on the top right corner. The background is blurred, but it appears to be a kitchen countertop with a knife and fork on the left side. The pouch is made of a light-colored fabric and has a zipper closure.",,0,
1nmf1ks,1nmf1ks_ae2b454770b92da6.jpg,grapefruit; hat; person,background; camera; durian; environment; exterior; front; fruit; grapefruit; grass; greenery; ground; hand; hat; image; leaf; person; photo; pole; seed; shirt; spiky; straw; tree; watermark,outdoor,photograph,3,24,1,1,"The image shows a man wearing a hat, holding a durian fruit in front of a tree. The ground is covered with grass and dried leaves, and there are watermarks on the image.","The image shows an elderly man wearing a straw hat and a blue shirt, sitting under a tree. He is holding a large durian fruit in his hands and is smiling at the camera. The durian is hanging from a wooden pole and has a large, round, spiky exterior with small, white seeds scattered throughout. The background is filled with other trees and greenery, suggesting that the photo was taken in a tropical or subtropical environment.",,0,
1nn3tfi,1nn3tfi_bebc7f18cc4632a5.jpg,chicken; poster,another; background; beak; bottom; cartoon; center; chicken; color; comb; competition; expression; fence; group; house; image; left; line; metal; middle; person; picture; poster; right; rooster; shirt; sign; sky; text; that; top; tree,plain_background,cartoon,2,31,1,1,"The image shows a wooden fence with a sign that reads ""Relax We're All Crazy"" and a picture of a group of chickens on it. In the background, there is a tree, a house, and a clear blue sky.","The image is a rectangular metal sign hanging on a wooden fence. The sign has a white background with black text that reads ""Relax We're All Crazy"" and ""It's Not Competition"". Below the text, there are six cartoon chickens of different colors - one is a rooster, another is a chicken, the third is a yellow chicken, and the fourth is a black chicken. The chickens are arranged in a line, with the rooster in the center, the chicken on the left, the roosters on the right, the chickens in the middle, and one on the bottom. The rooster has a red comb on its head and a yellow beak. The chicken on top is wearing a blue and white striped shirt and has a mischievous expression on its face.",,0,
1npoas3,1npoas3_d8f82f96b77b02f4.jpg,fancy dress; person; poster; suit; tie,atmosphere; background; both; bottom; dress; fancy dress; flower; garden; greenery; hand; image; keanu; meme; old; peace; person; photo; plant; poster; reeves; side; sign; suit; text; they; tie; tuxedo; veil; wedding; who; wife; year; years,garden,photograph,5,33,1,1,"The image shows Keanu Reeves and his wife, both of them smiling, with the text ""Keanu Reeves Got Married at 61 Years Old"" at the bottom. In the background, there are plants with flowers, creating a romantic atmosphere.","The image is a meme featuring a photo of Keanu Reeves and his wife, who are married at 61 years old. Keanu is on the left side of the image, wearing a black tuxedo and bow tie, and the wife on the right side is wearing a white wedding dress with a veil. They are both smiling and making a peace sign with their hands. The background is a garden with white flowers and greenery. The text on the image reads ""Keanu Reeves got married at 6 years old.""",,0,
1nkr9ym,1nkr9ym_b1133db44a301651.jpg,horse,background; body; building; coat; color; crested; distance; dog; ear; eye; fur; horse; image; leg; look; mane; mood; person; side; sky; surface; table; tail; that; top; tree; water,blurred_background,,1,27,1,0,"The image shows a Chinese Crested dog standing on top of a wooden table, with a blurred background. The dog has a white coat with a thick, shaggy coat of fur that is typically white in color. Its ears are perked up and its eyes are alert, giving it a curious and inquisitive look.","The image is of a Chinese Crested dog standing on a wooden surface. The dog is light brown in color with a white mane and tail. It is standing upright with its front legs slightly apart and its head turned slightly to the side. The background is blurred, but it appears to be a body of water with trees and buildings in the distance. The sky is overcast and the overall mood of the image is peaceful and serene.",,0,
1nrjmzk,1nrjmzk_056bd72ce7e54be6.jpg,car; mirror,area; background; body; bush; car; cat; chair; four; grass; image; mirror; panther; plant; rearview; reflection; side; sky; tail; tree; water,park,,2,20,1,0,"The image shows a black panther standing in the back seat of a car, surrounded by lush green grass, plants, and trees, with a body of water in the background and a clear blue sky above.","The image shows a black cat walking on the side of a car. The car is parked in a wooded area with trees and bushes in the background. The cat is walking towards the right side of the image, with its tail curled around its body. It appears to be walking on all fours. The reflection of the cat can be seen in the rearview mirror of the car.",,0,
1nt6p8q,1nt6p8q_0998dac6735b455b.jpg,person,aesthetic; arm; background; blood; bottom; center; cross; design; eagle; front; hand; image; imagery; ink; periphery; peripherys; person; plant; room; shape; shield; side; skull; song; sword; symbol; text; that; top; variety; wall; warrior,indoor; room,black_and_white,1,32,2,1,"The image shows a person's hand with a black and white tattoo of a viking warrior on it. The tattoo is intricate and detailed, with a variety of shapes and symbols that make it stand out. The text at the top and bottom of the image adds to the overall aesthetic.","The image is a black and white tattoo on someone's arm. The tattoo is titled ""My ""Blood Eagle"" inspired tattoo"" and is by far my favorite Periphery song, and this entire arm will get covered in Peripherys themed imagery. It features a detailed design of a skull, a sword, and a shield, all in black ink. The skull is in the center of the tattoo, with the sword and shield on either side. The shield is on the left side of the arm, with a cross on top. The sword is crossed over the shield, and the shield is in front of it. The background is blurred, but it appears to be a room with a white wall and a plant.",,0,
1nuyw6n,1nuyw6n_9e0a8c9ebb586e8c.jpg,footwear; person; scarf,back; background; backpack; bag; boot; bun; coat; contrast; expression; footwear; ground; hair; hand; image; jacket; mood; path; person; scarf; she; shoe; sky; snow; surrounding; white; wintery,snowy,,3,26,1,0,"The image shows a woman walking in the snow with a backpack, wearing a green jacket, scarf, and shoes. The background is a stark white, creating a stark contrast between the woman and her surroundings.","The image shows a young woman walking on a snowy path. She is wearing a green coat, a red scarf, and brown boots. She has a backpack on her back and is holding a red bag in her left hand. Her hair is tied up in a messy bun and she has a serious expression on her face. The background is a light blue sky and the ground is covered in snow. The overall mood of the image is cold and wintery.",,0,
1nxr0ms,1nxr0ms_11f064c8052b28b6.jpg,shelf,background; bag; basket; bird; book; color; flower; hand; illustration; image; item; letter; object; picture; plant; shelf; store; stores; style; text; top; tote; variety; vas; vase; word,shop,black_and_white; drawing; illustration; minimalist,1,26,1,4,"The image shows a tote bag with a picture of a store on it. The bag is decorated with a variety of items, including flower vases, a bird, and other objects. The text on the bag reads ""Stores"".","The image is a black and white illustration of a store shelf with various items on it. The shelf is filled with books, plants, and other decorative items. On top of the shelf, there is a vase with flowers, a bird, and a basket. The word ""STORES"" is written in bold letters above the shelf. The background is a light beige color. The illustration is done in a simple, hand-drawn style.",,0,
1npaqxw,1npaqxw_21eb9c0558ece174.jpg,christmas tree; pillow,acquisti; acquistii; background; cartellino; christmas; christmas tree; color; con; couch; cuscino; description; design; each; english; image; italian; mano; nataliizio; natalizio; nuovo; paper; pattern; photograph; pillow; pine; plant; price; protezione; protezzo; row; shape; sofa; tag; text; that; throw; tree; venduto; which; €,plain_background,photograph,2,40,1,1,"The image shows a pillow with a festive design of Christmas trees on it, placed on a sofa with a plant in the background. The text on the pillow reads ""Cuscino Nataliizio"" which translates to ""Christmas Tree Pillow"" in English.","The image is a photograph of a decorative throw pillow on a couch. The pillow is square in shape and has a white background. On the pillow, there are six small pine trees arranged in a row, each with a different color - green, yellow, and white. The trees are made of paper and are arranged in an intricate pattern. The text on the pillow reads ""Venduto"" which translates to ""Cuscino natalizio"" in English. Below the text, there is a description of the pillow in Italian that reads ""40 x 40 cm - Nuovo con cartellino - Mano"". The pillow also has a price tag of €7,00 € and a description that says ""Include la Protezione acquisti"" which is Italian for ""Included with the Protezzo acquistii"".",,0,
1npu5c5,1npu5c5_5d0fa49ffe953bef.jpg,monkey,angle; background; ball; chimpanzee; cup; deck; door; fence; front; gorilla; grass; hand; hind; image; leg; monkey; object; plant; rock; sky; tree,,,1,21,0,0,"The image shows a gorilla sitting on its hind legs in front of a glass door, surrounded by plants, grass, a rock, a tree, and the sky. The gorilla appears to be playing with a ball, as if it is trying to catch it.","The image shows a chimpanzee standing on its hind legs on a wooden deck. The chimpanzee is holding a small object in its hands and appears to be reaching up towards the sky. The background shows a wooden fence and some plants. The image is taken from a low angle, looking up at the chimpanzee.",,0,
1np1v6h,1np1v6h_ace81318e92ce606.jpg,cat; person; picture frame,background; bed; bottom; cat; checkmark; color; corner; couch; cushion; dress; eye; frame; gold; heart; icon; image; lap; painting; person; picture frame; pillow; she; shoulder; text; that,,painting,3,25,0,1,"The image shows a woman laying on a bed with a black cat perched on her shoulder. She is wearing a yellow dress and there is a pillow behind her. At the bottom of the image, there is text that reads ""Find similar"".","The image is a painting of a young woman sleeping on a green couch with a black cat curled up on her lap. The woman is wearing a yellow dress and has her eyes closed. The cat is black and is resting its head on the woman's shoulder. The background is a light blue color and the couch is covered with a green cushion. The painting is framed in a gold-colored wooden frame. There are three icons on the top right corner of the image - a heart, a heart icon, and a checkmark. The text ""Find similar"" is written below the image.",,0,
1nwogyh,1nwogyh_1f745540e2fafd1d.jpg,pig; skull,art; background; band; blue; boar; brown; cog; color; dress; expression; feel; gear; hand; hind; illustration; image; leg; mood; paper; person; pig; representation; shade; side; skeleton; skull; staff; steampunk; texture; variety; wheel; which,,black_and_white; illustration,2,32,0,2,"The image shows a skeleton riding a boar with a wheel, which is a representation of the steampunk-inspired art of the band The Boar. The skeleton is wearing a long, flowing dress and has a determined expression on its face, while the boar is a deep, dark brown color with a few lighter shades of brown. The wheel is a large, circular wheel with a variety of gears and cogs, and the skeleton is holding a staff in its right hand. The background is a light, dark blue, giving the image a mysterious and edgy feel.","The image is a black and white illustration of a skeleton and a boar. The skeleton is standing on its hind legs and is holding a large gear wheel in its right hand. The boar is walking ahead of the skeleton, with its front legs stretched out and its head turned to the side. The background is a beige-colored paper with a rough texture. The overall mood of the image is dark and ominous.",,0,
